warehouse_id,city,state,warehouse_name
2fa13c8bd5705d279f7ed5cc9ec61c68,sao paulo,SP,AeroLink Sao Paulo Freight Terminal
e627629ba868740e287800f1a9be81c2,sao paulo,SP,UrbanLift Sao Paulo Logistics Hub
c72de06d72748d1a0dfb2125be43ba63,guanambi,BA,BlueLane Guanambi Logistics Hub
8d79c8a04e42d722a75097ce5cbcf2ef,caucaia,CE,RouteSphere Caucaia Transit Hub
8060d731897e33b5c5ae575ce1e209e1,blumenau,SP,AeroLink Blumenau Distribution Center
4c4d546adf3c3868fe19c9ec6e9ffda9,maringa,PR,SkyRoute Maringa Freight Terminal
5a9c0859cb00fd8aa4db443837f0a700,treze tilias,SC,AeroLink Treze Tilias Freight Terminal
cecd97bc34ed8330bd4cd15713eda670,cordilheira alta,SC,TerraFleet Cordilheira Alta Supply Depot
9c3a1c416c765687bc79a04113269929,carmo da mata,MG,MetroCargo Carmo Da Mata Logistics Hub
8ae520247981aa06bc94abddf5f46d34,navegantes,SC,SkyRoute Navegantes Logistics Hub
ac3508719a1d8f5b7614b798f70af136,canoas,RS,BlueLane Canoas Freight Terminal
15cd6eefe58588619aaed41dfa6621b1,ouro preto,MG,AeroLink Ouro Preto Transit Hub
4a3ca9315b744ce9f8e9374361493884,ibitinga,SP,UrbanLift Ibitinga Freight Terminal
478bfe564db21eeb44386606aa30b650,pedro leopoldo,MG,SkyRoute Pedro Leopoldo Supply Depot
6d988d6174a2c27441597174f8905515,maringa,PR,SkyRoute Maringa Supply Depot
ed49da7cadefc454d6a67de249eab240,sao paulo,SP,CargoPulse Sao Paulo Supply Depot
6f892e20a171e98efe17fdb971ff319b,sao paulo,SP,AeroLink Sao Paulo Transit Hub
4bfc7a4a1cf8d4d2121c27422d9e50b5,sao paulo,SP,RouteSphere Sao Paulo Logistics Hub
acadd4d36859671cb635527c6c977533,santa rosa de viterbo,SP,AeroLink Santa Rosa De Viterbo Distribution Center
034b9387752bfa309f350a70cd45ffa3,blumenau,SC,SkyRoute Blumenau Transit Hub
a1ed30492b3b798bc121845bc4aa7366,sao paulo,SP,AeroLink Sao Paulo Transit Hub
abbf6046bbdf1028606a5bc7f00c99e7,xanxere,SC,RouteSphere Xanxere Logistics Hub
901b460cdce0c64e471230d7f2f9f3a3,porto alegre,RS,BlueLane Porto Alegre Logistics Hub
81ed90f07c0bacb7594940ba2ef676aa,divinopolis,MG,UrbanLift Divinopolis Logistics Hub
11eac105f3f90a9b87b19c89d91e24f3,sao paulo,SP,SkyRoute Sao Paulo Logistics Hub
0725b8c0f3f906e58f70cbe76b7c748c,guarulhos,SP,CargoPulse Guarulhos Freight Terminal
d1a5cc844736958c11b8efab9a2b4c87,curitiba,PR,CargoPulse Curitiba Supply Depot
f35becee938e982bd615edf8ef12bcfb,alvares machado,SP,RouteSphere Alvares Machado Logistics Hub
634964b17796e64304cadf1ad3050fb7,rio de janeiro,RJ,NovaPort Rio De Janeiro Supply Depot
6624bc09786f0e41ae48dfc5eeb1a9e2,belo horizonte,MG,MetroCargo Belo Horizonte Transit Hub
54219883e72aad869adfb2a54b7bfa0f,sorocaba,SP,UrbanLift Sorocaba Freight Terminal
5795aebfe331fbcd02a2c4b679fb7952,palhoca,SC,AeroLink Palhoca Distribution Center
6e2d3e2dc84fb30f6078f39dd3bddd6f,colombo,PR,TerraFleet Colombo Supply Depot
3078096983cf766a32a06257648502d1,scao jose do rio pardo,SP,TerraFleet Scao Jose Do Rio Pardo Distribution Center
014d9a685fd57276679edd00e07089e5,maringa,PR,BlueLane Maringa Distribution Center
656591be56071d4c9ef4e5fee78a578a,santo andre,SP,CargoPulse Santo Andre Logistics Hub
26562f211dd1364af2a8596dc945e8ae,sao bernardo do campo,SP,UrbanLift Sao Bernardo Do Campo Supply Depot
bccf933e006e9b94a6184af782963e77,assis,SP,CargoPulse Assis Transit Hub
12c2ed9cded6138cf0c75f525f565fc7,praia grande,SP,TerraFleet Praia Grande Distribution Center
961dff0a659b4561334372337dd897d9,rio de janeiro,RJ,PrimeAxis Rio De Janeiro Freight Terminal
b33e7c55446eabf8fe1a42d037ac7d6d,pradopolis,SP,PrimeAxis Pradopolis Distribution Center
2235cf78d3e2073a88146a9cb60f0dd0,sao paulo,SP,PrimeAxis Sao Paulo Transit Hub
218d46b86c1881d022bce9c68a7d4b15,ribeirao preto,SP,UrbanLift Ribeirao Preto Transit Hub
08d1c9478fb0d7d7fcac9c0da4e82fc7,belo horizonte,MG,TerraFleet Belo Horizonte Supply Depot
dfc475d54e1b6dbeeb7d7d9bdaa63827,curitiba,PR,RouteSphere Curitiba Freight Terminal
813348c996469b40f2e028d5429d3495,jundiai,SP,UrbanLift Jundiai Freight Terminal
c394e193cda3b4225ff2094d32184849,sao paulo,SP,MetroCargo Sao Paulo Freight Terminal
2745f798279e0ed033addcc1474776d7,sao paulo,SP,CargoPulse Sao Paulo Distribution Center
6b803197e03abd5056b4313306b4f29d,sao paulo,SP,UrbanLift Sao Paulo Logistics Hub
bafc5aa11e413978be29040f51342e70,belo horizonte,MG,NovaPort Belo Horizonte Supply Depot
44717f64ec2a457979cf83c429077666,santa rosa,RS,UrbanLift Santa Rosa Logistics Hub
b7cc6c5e001441ae8cdd5c69a480cbe4,curitibanos,SC,CargoPulse Curitibanos Freight Terminal
af7cdac9d9897cddead9c6b08976c642,laranjal paulista,SP,BlueLane Laranjal Paulista Freight Terminal
b3e2faf2c1004d674f16a3aa3197f0e1,ribeirao preto,SP,PrimeAxis Ribeirao Preto Distribution Center
670a9dda115b5a88b18cfadee8de2332,ribeirao preto,SP,MetroCargo Ribeirao Preto Supply Depot
3b15288545f8928d3e65a8f949a28291,ibitinga,SP,SkyRoute Ibitinga Transit Hub
3e35a8bb43569389d3cebef0ce820f69,sao paulo,SP,UrbanLift Sao Paulo Supply Depot
81783131d2a97c8d44d406a4be81b5d9,sorocaba,SP,AeroLink Sorocaba Freight Terminal
29e6e05b65f93bc224c644319dc52ecf,juiz de fora,MG,CargoPulse Juiz De Fora Supply Depot
cce6ab8d1682639fe45ab70234f1665f,curitiba,SP,AeroLink Curitiba Freight Terminal
e1643dff33666ca629e3644c02738179,sao paulo,SP,NovaPort Sao Paulo Freight Terminal
76623fde66e6b63b59440fd34160512d,guarulhos,SP,MetroCargo Guarulhos Supply Depot
5275ca25d0358ca73864e0ae41be1320,guarulhos,SP,AeroLink Guarulhos Transit Hub
eb4df17aed01d918c65f0f8d650900c0,paulinia,SP,PrimeAxis Paulinia Logistics Hub
10089e9f2fd0c668a8fd4e52e1698888,sao jose do rio preto,SP,RouteSphere Sao Jose Do Rio Preto Logistics Hub
c398bc00a606d33758afd91f4e64fd15,rio de janeiro,RJ,MetroCargo Rio De Janeiro Distribution Center
2f09f7d37a97956d11cc1a7cadd5262b,ribeirao preto,SP,BlueLane Ribeirao Preto Freight Terminal
e58a5b390e28abc0b216cfb0e07d27d7,rio de janeiro,RJ,NovaPort Rio De Janeiro Freight Terminal
f41ce2e25237f9092cd8e6e7516c7a2f,guarulhos,SP,TerraFleet Guarulhos Logistics Hub
8e6cc767478edae941d9bd9eb778d77a,araguari,MG,UrbanLift Araguari Transit Hub
028872bfa080090a9d0abd4f1af168f8,ribeirao das neves,MG,AeroLink Ribeirao Das Neves Distribution Center
1710c3aaa9c6b44ec3883ee0fe300e21,sao caetano do sul,SP,BlueLane Sao Caetano Do Sul Transit Hub
52d76513f0c4d97f3b99570e2c94ee31,novo hamburgo,RS,TerraFleet Novo Hamburgo Logistics Hub
dace965ca58120f92f8d742a9fa1864b,sao paulo,SP,AeroLink Sao Paulo Transit Hub
f5b44895715ddfe3087dc414f30268f3,sorocaba,SP,AeroLink Sorocaba Logistics Hub
c8467937e403e76a8ee9f0ab13f6f5ef,pocos de caldas,MG,AeroLink Pocos De Caldas Transit Hub
56f413900b5166ab4d730e9ac0b12cb0,sorocaba,SP,AeroLink Sorocaba Distribution Center
3f8034bfc6b8b4135534975d49f04c63,curitiba,PR,MetroCargo Curitiba Transit Hub
4992e76a42cb3aad7a7047e0d3d7e729,sao paulo,SP,RouteSphere Sao Paulo Transit Hub
265fdc289dffa9f1ad801c74f7d0de47,jaci,SP,TerraFleet Jaci Transit Hub
0afccdb8a34ee5c79f7c06faf2b4d56e,uberlandia,MG,RouteSphere Uberlandia Freight Terminal
02dcd3e8e25bee036e32512bcf175493,contagem,MG,SkyRoute Contagem Distribution Center
c9e5ad1f6647f5dbd1172adf6ae3cada,porto alegre,RS,AeroLink Porto Alegre Transit Hub
02a2272692e13558373c66db98f05e2e,rio de janeiro,RJ,RouteSphere Rio De Janeiro Distribution Center
f783a638e9c6af4a7d0dbfde811e7a81,sao paulo,SP,MetroCargo Sao Paulo Freight Terminal
0b18d63d0cd1d723567903fd34a07df2,sp,SP,TerraFleet Sp Logistics Hub
3ef37b7ca6dd2b80bd8af81a62504996,sao paulo,SP,TerraFleet Sao Paulo Distribution Center
dd4d95ba2d15c071e6c695e2ef6ce169,cachoeiro de itapemirim,ES,AeroLink Cachoeiro De Itapemirim Logistics Hub
7bb8fac2913a6064ec412e583c6d8b4d,bauru,SP,NovaPort Bauru Logistics Hub
86649b1632b1c0e6c0bcb2c90a8b75d8,medianeira,PR,BlueLane Medianeira Transit Hub
8dd386be0767c330276ea6a3f96532d3,paulo lopes,SC,UrbanLift Paulo Lopes Logistics Hub
deaadd805612bf94faaa9fa702516e11,sao paulo,SP,CargoPulse Sao Paulo Transit Hub
5e063e85d44b0f5c3e6ec3131103a57e,sao paulo,SP,SkyRoute Sao Paulo Distribution Center
6e4f5ff6b086632ba8dcb558fb10249e,flores da cunha,RS,TerraFleet Flores Da Cunha Transit Hub
117cfc326c6d50da67ca858ff5c0c852,sao joao de meriti,RJ,AeroLink Sao Joao De Meriti Supply Depot
d25aa0aaacb370e912f8cf6efeba38b3,massaranduba,SC,MetroCargo Massaranduba Supply Depot
c0e6839516f5398edc34adf5f1d53d1a,guaruja,SP,TerraFleet Guaruja Supply Depot
119c7f1a00ef43fad0e57604e76a747c,sao paulo,SP,RouteSphere Sao Paulo Supply Depot
2953ce3a88f5e3c3b696d77fc9e4c8eb,sao paulo,SP,TerraFleet Sao Paulo Freight Terminal
bbf9ad41dca6603e614efcdad7aab8c4,fortaleza,CE,NovaPort Fortaleza Freight Terminal
d7b2377bae6ace1b11fc69a11900ac36,sao paulo,SP,UrbanLift Sao Paulo Distribution Center
57fe6232e67823593374a2281d7a8af8,capivari,SP,RouteSphere Capivari Logistics Hub
4da0e408c99d2fdc2126dc9fce518060,cornelio procopio,PR,PrimeAxis Cornelio Procopio Distribution Center
8b28d096634035667e8263d57ba3368c,sao jose dos campos,SP,UrbanLift Sao Jose Dos Campos Transit Hub
82cb9f452fe8334df74b22d37824b431,caxias do sul,RS,TerraFleet Caxias Do Sul Supply Depot
9bc484c87d79cd4874e05ca182658045,sao paulo,SP,UrbanLift Sao Paulo Transit Hub
c6218512d16fcac0af02fe92691cf274,contagem,MG,UrbanLift Contagem Supply Depot
d17f467e4bf608a510c20d82f4ba3b6b,caxias do sul,RS,AeroLink Caxias Do Sul Supply Depot
4371b634e0efc0e22b09b52907d9d469,sao paulo,SP,AeroLink Sao Paulo Distribution Center
1b45169b635ef59425637e9a33eb5fb3,maringa,PR,AeroLink Maringa Logistics Hub
bd23da7354813347129d751591d1a6e2,sao paulo,SP,MetroCargo Sao Paulo Supply Depot
412a4720f3e9431b4afa1476a1acddbe,campinas,SP,CargoPulse Campinas Supply Depot
7238a95bb63ef7e498389fb863b834a1,limeira,SP,AeroLink Limeira Transit Hub
26785a546900236d66f2e4197c211158,sao paulo,SP,SkyRoute Sao Paulo Freight Terminal
b7ed9fb14c8eadb37adb9c45d67ab0fb,jacarei,SP,NovaPort Jacarei Logistics Hub
a0d7fbb07bb5ebc3b05980e750db56f3,ferraz de vasconcelos,SP,UrbanLift Ferraz De Vasconcelos Freight Terminal
10264f60a8f0a4d2f30810f5c661c673,campinas,SP,RouteSphere Campinas Transit Hub
35857757f553273b1056c1cabdace7fb,ribeirao preto,SP,NovaPort Ribeirao Preto Distribution Center
538caafddff204241cecbf3a02e6b3cf,sao paulo,SP,BlueLane Sao Paulo Transit Hub
913fd0ebba70bb919f7254a02239173c,blumenau,SC,AeroLink Blumenau Logistics Hub
b2eecf5ea250510da76590ca79d60e5d,sao paulo,SP,UrbanLift Sao Paulo Supply Depot
1c742ac33582852aaf3bcfbf5893abcf,belo horizonte,MG,CargoPulse Belo Horizonte Supply Depot
8f2ce03f928b567e3d56181ae20ae952,pirituba,SP,RouteSphere Pirituba Supply Depot
4d9fea3499bdc22aa4da4e339365f215,sao paulo,SP,SkyRoute Sao Paulo Logistics Hub
d4e12e7884759a14fa0f5f896c791cae,sao paulo,SP,PrimeAxis Sao Paulo Distribution Center
e24fc9fcd865784fb25705606fe3dfe7,braganca paulista,SP,RouteSphere Braganca Paulista Transit Hub
5882f40daf39bc2a465e0cb453ddc222,sao paulo,SP,AeroLink Sao Paulo Supply Depot
26e2c91ef821e1ff8985f408788fe35b,ibitinga,SP,MetroCargo Ibitinga Logistics Hub
53336f97ddbe53e2a617d07b17447b95,sao paulo,SP,TerraFleet Sao Paulo Transit Hub
fec8cd45395b3cb0c2b173d7739706a1,jambeiro,SP,NovaPort Jambeiro Freight Terminal
e116c7455dd26a4d8c3e92532583905f,sao paulo,SP,AeroLink Sao Paulo Supply Depot
900ba814c251a692506d7834c1218441,salto,SP,BlueLane Salto Freight Terminal
afe0067131b73e40875c9b6c10bd2e21,lagoa da prata,MG,RouteSphere Lagoa Da Prata Freight Terminal
542917da124346b47ea1ac79a93ce454,curitiba,PR,CargoPulse Curitiba Freight Terminal
35b96509602ec4b7da831b5cd73ff2c2,sao leopoldo,RS,BlueLane Sao Leopoldo Logistics Hub
4a23adac87cf538689fa600d976f78b2,sao paulo,SP,SkyRoute Sao Paulo Distribution Center
85cc55e048b6bcc90c75afe7f0e72f72,barra mansa,RJ,TerraFleet Barra Mansa Supply Depot
2009a095de2a2a41626f6c6d7722678d,sao jose do rio preto,SP,PrimeAxis Sao Jose Do Rio Preto Distribution Center
3a52d63a8f9daf5a28f3626d7eb9bd28,aguas claras df,SP,NovaPort Aguas Claras Df Distribution Center
e9b6c33b71b67737693b4cfa68341c8d,sao paulo,SP,CargoPulse Sao Paulo Supply Depot
c458e2045a8aa8964f8879af03fdcce6,sao caetano do sul,SP,UrbanLift Sao Caetano Do Sul Logistics Hub
6601ee6383e7f452be71929f8de48bbb,ribeirao pretp,SP,SkyRoute Ribeirao Pretp Distribution Center
5a4236931428800e9d9cc04af0987118,sao paulo,SP,PrimeAxis Sao Paulo Transit Hub
258447aad3f7b01e2643c89f64dc5647,cianorte,PR,CargoPulse Cianorte Transit Hub
8a32e327fe2c1b3511609d81aaf9f042,sao paulo,SP,PrimeAxis Sao Paulo Distribution Center
0f519b0d2e5eb2227c93dd25038bfc01,ibitinga,SP,NovaPort Ibitinga Supply Depot
d7d517afce974cd491b8d52bb5b5b1fc,sao paulo,SP,AeroLink Sao Paulo Distribution Center
ec5c1d94df153d473b37f880977ae58e,rio de janeiro,SP,SkyRoute Rio De Janeiro Transit Hub
31561f325664a8a7aba4c8d0c3a9b3db,sao paulo,SP,CargoPulse Sao Paulo Distribution Center
70c4eedec9cb4a85cda2f3f9673557b4,sao paulo,SP,NovaPort Sao Paulo Transit Hub
4fb41dff7c50136976d1a5cf004a42e2,feira de santana,BA,MetroCargo Feira De Santana Logistics Hub
d23019c84ffae2d5ef2270367b8605fc,londrina,PR,TerraFleet Londrina Supply Depot
ad8ada0ffa993cb1197d102d9ab21a3e,araguari,MG,RouteSphere Araguari Supply Depot
ce20a2ec1514c25e16f2b5b39bc818f0,sao paulo,SP,MetroCargo Sao Paulo Transit Hub
0f94588695d71662beec8d883ffacf09,florianopolis,SC,SkyRoute Florianopolis Logistics Hub
3a79f35a2344ede41af21267f61d5ec6,campinas,SP,NovaPort Campinas Logistics Hub
b586cd24c010a13916af621b0325fbba,rio do sul,SC,RouteSphere Rio Do Sul Freight Terminal
2075d8cd4dd63ff12df0749a5866bb06,curitiba,PR,NovaPort Curitiba Supply Depot
0d83f8e03188682112cc0d93523705cc,porto alegre,RS,MetroCargo Porto Alegre Logistics Hub
85044848b1b767db2a4a58526adef4b4,osasco,SP,UrbanLift Osasco Logistics Hub
c3251e13f1bbda6c74e37c160f991e19,porto ferreira,SP,PrimeAxis Porto Ferreira Distribution Center
4a1f694197d05fe70026b016a7316b41,pedreira,SP,UrbanLift Pedreira Supply Depot
6ebf4eceee4dd9847201c82e77ef8123,rio de janeiro,RJ,MetroCargo Rio De Janeiro Logistics Hub
0873d9f8f36123f8d910f4760e788cfb,barueri,SP,SkyRoute Barueri Freight Terminal
a44fb5a447105f8469bdf16bf9159f25,porto alegre,RS,MetroCargo Porto Alegre Transit Hub
dcf3755cefcdc158ad0b7bdde51e871b,cachoeira do sul,RS,SkyRoute Cachoeira Do Sul Logistics Hub
4869f7a5dfa277a7dca6462dcf3b52b2,guariba,SP,SkyRoute Guariba Transit Hub
6bb66d9870c2e01c05655c7ed0e7ee13,sao paulo,SP,UrbanLift Sao Paulo Supply Depot
1c5e4e49b9079480255b49d50aac1aa9,santos,SP,TerraFleet Santos Distribution Center
6a3139c7bf09ece22a4713d956acbe5e,sao sebastiao da grama/sp,SP,SkyRoute Sao Sebastiao Da Grama/Sp Distribution Center
37515688008a7a40ac93e3b2e4ab203f,dracena,SP,UrbanLift Dracena Logistics Hub
8fec2e460530482132c436cfb5439925,laranjal paulista,SP,CargoPulse Laranjal Paulista Supply Depot
1746c1ae87ac63d530c7c943d0ac42e2,santana de parnaiba,SP,BlueLane Santana De Parnaiba Transit Hub
afac9f6b0c4e5f0a7ee87e922cd0f873,bauru,SP,AeroLink Bauru Transit Hub
3be5841cdcc46de4ed3f9116f104b2c5,barueri,SP,BlueLane Barueri Freight Terminal
0249d282d911d23cb8b869ab49c99f53,sao paulo,SP,PrimeAxis Sao Paulo Logistics Hub
23ca5f678e0b3ea6c630b30fa8bf51ea,sao paulo,SP,BlueLane Sao Paulo Freight Terminal
5eeb9c756d9780b96283e5a2ac6da334,ribeirao preto,SP,UrbanLift Ribeirao Preto Logistics Hub
25be943a321c8938947bdaabca979a90,sao bernardo do campo,SP,PrimeAxis Sao Bernardo Do Campo Transit Hub
818d28f936e791926d33bcb6ee94ef79,sao paulo,SP,UrbanLift Sao Paulo Freight Terminal
bfd938b22bc99bce1ae60dc602889f52,rio de janeiro,RJ,MetroCargo Rio De Janeiro Distribution Center
c12b92bf1c350f3e6bf88d3596219c86,garca,SP,UrbanLift Garca Distribution Center
97e995629983723d11830a829bc2b246,lorena,SP,NovaPort Lorena Distribution Center
ffa6adafb71b807dc13159e26431354c,londrina,PR,NovaPort Londrina Freight Terminal
080102cd0a76b09e0dcf55fcacc60e05,belo horizonte,MG,BlueLane Belo Horizonte Freight Terminal
5a6a02f419701fc8c605af71d4fc57a4,americana,SP,BlueLane Americana Distribution Center
94b9108d4b637ba65bb4f1e53cfcf8d8,guarulhos,SP,CargoPulse Guarulhos Supply Depot
0fe2d9733ed841eb064503920015a8c0,ourinhos,SP,AeroLink Ourinhos Logistics Hub
154bdf805377afea75a3bd158e9eab10,ibitinga,SP,UrbanLift Ibitinga Logistics Hub
b2ac621f0d0322434d04a12b078b9369,curitiba,PR,UrbanLift Curitiba Transit Hub
9c54608f0996c32ae4743089d915f845,loanda,PR,SkyRoute Loanda Freight Terminal
17306570e772e7718c92a562d33f5f1d,bariri,SP,PrimeAxis Bariri Supply Depot
244c2f1bff6afe1f2eaf9bfe9b2aed38,mogi das cruzes,SP,TerraFleet Mogi Das Cruzes Logistics Hub
71039d19d4303bf9054d69e9a9236699,sao paulo,SP,PrimeAxis Sao Paulo Freight Terminal
54065e9aef7e9e9c2dc23b7594db021a,rio de janeiro,RJ,RouteSphere Rio De Janeiro Freight Terminal
7ad41305e96a6cab8294cd65891e9a86,rio bonito,SP,TerraFleet Rio Bonito Freight Terminal
25e47381a6c510ddeb36084e33b89f0c,praia grande,SP,TerraFleet Praia Grande Logistics Hub
4d6d651bd7684af3fffabd5f08d12e5a,jau,SP,TerraFleet Jau Transit Hub
24a6daf925d9d591870a66660416de31,robeirao preto,SP,CargoPulse Robeirao Preto Supply Depot
f0563bacf40c311f1c4d3d6b67b8a7a7,tubarao,SC,AeroLink Tubarao Transit Hub
b76dba6c951ab00dc4edf0a1aa88037e,sao paulo,SP,CargoPulse Sao Paulo Transit Hub
1bc2e21de46adfea6b98cc96b00f3b40,joinville,SC,BlueLane Joinville Transit Hub
b1204cfda1d4948679db3cfc0d3cb95c,guarulhos,SP,MetroCargo Guarulhos Logistics Hub
b4ffb71f0cb1b1c3d63fad021ecf93e1,sao paulo,SP,AeroLink Sao Paulo Distribution Center
165b1235e9e9942cb5fae67103576fb0,ribeirao preto,SP,PrimeAxis Ribeirao Preto Logistics Hub
8eb88b0acb3f90a717ad659221471fa7,cacador,SC,BlueLane Cacador Logistics Hub
9599519be538b98748162a2b48248960,sao paulo,SP,MetroCargo Sao Paulo Logistics Hub
0417b067eeab773d2f7061a726dc477f,sao bento do sul,SC,UrbanLift Sao Bento Do Sul Distribution Center
c26ba52cf8d2f34915f2f6b7ffa0a3f3,rio de janeiro,RJ,NovaPort Rio De Janeiro Freight Terminal
e5cbe890e679490127e9a390b46bbd20,sao paulo,SP,AeroLink Sao Paulo Distribution Center
974cf2cb8f4b7add98709c30df02fe10,araraquara,SP,MetroCargo Araraquara Distribution Center
3c487ae8f8d7542beff5788e2e0aea83,gama,DF,BlueLane Gama Transit Hub
4a3ccda38b2129705f3fb522db62ca31,marilia,SP,MetroCargo Marilia Logistics Hub
876182d1918783bbe15233febfbd4926,sao paulo,SP,RouteSphere Sao Paulo Supply Depot
33576ec5412fb5905d876f12f33bfde6,curitiba,PR,TerraFleet Curitiba Freight Terminal
5b85809efd0d0e4dea1a9544e1280ed9,presidente prudente,SP,PrimeAxis Presidente Prudente Transit Hub
5566627eab3fe93fd6ee08798226101a,sao jose dos pinhais,PR,PrimeAxis Sao Jose Dos Pinhais Supply Depot
e504a4e2efaa45cbff7e268a2c58c956,sao pedro,SP,TerraFleet Sao Pedro Distribution Center
056b4ada5bbc2c50cc7842547dda6b51,queimados,RJ,CargoPulse Queimados Transit Hub
1e483cc5c76fef08d3ca05f9a8af7d01,sao paulo,SP,CargoPulse Sao Paulo Freight Terminal
9b1050e85becf3ae99c1cf4934c9bc5d,montes claros,MG,MetroCargo Montes Claros Freight Terminal
b248792ac0b60ec3f93d80af1b4fae47,sao caetano do sul,SP,RouteSphere Sao Caetano Do Sul Transit Hub
34056b8b55c1775a22af2331670a799c,penapolis,SP,MetroCargo Penapolis Transit Hub
21d59342ba150175ca2aa4f8faddeca6,itaquaquecetuba,SP,TerraFleet Itaquaquecetuba Freight Terminal
23c38debaffe4a25a30fdbd9b586a13f,votorantim,SP,MetroCargo Votorantim Transit Hub
d9c349beabc06aa6ff1c6d68b5e9e22e,sao paulo,SP,CargoPulse Sao Paulo Freight Terminal
49f8d2ea7b718d0ce587d34207caf2b4,sao bernardo do campo,SP,PrimeAxis Sao Bernardo Do Campo Supply Depot
bd1d49a326abfa9b1036772e40445430,bauru,SP,CargoPulse Bauru Distribution Center
6861de0f40cacb0602e473c51639f980,curitiba,PR,TerraFleet Curitiba Transit Hub
c9c7905cffc4ef9ff9f113554423e671,itapecerica da serra,SP,TerraFleet Itapecerica Da Serra Distribution Center
aa17b35ce4de7b565be3249ba838944f,jundiai,SP,AeroLink Jundiai Logistics Hub
0887a9f087bcd5d9f6642b52f897fc6c,cananeia,SP,PrimeAxis Cananeia Logistics Hub
abc015ebac1d283a323ca9db35ede4b9,ribeirao preto,SP,NovaPort Ribeirao Preto Distribution Center
00720abe85ba0859807595bbf045a33b,guarulhos,SP,BlueLane Guarulhos Transit Hub
75d34ebb1bd0bd7dde40dd507b8169c3,salvador,BA,RouteSphere Salvador Freight Terminal
e5e33c0d8e7e002f398f5dc4cbbb338f,bauru,SP,UrbanLift Bauru Freight Terminal
8f54d64f28a993550aa7943f12572959,ipatinga,MG,BlueLane Ipatinga Supply Depot
91f5779a8731baca4809fdeade81803f,barra mansa,RJ,CargoPulse Barra Mansa Transit Hub
13074f016982ff2bd6c58ced8682f000,bento goncalves,RS,CargoPulse Bento Goncalves Transit Hub
bec568278124768c474ee90971ca94d1,sao paulo,SP,CargoPulse Sao Paulo Logistics Hub
534a01cc6df1e034e05c32028a291fa2,jundiai,SP,PrimeAxis Jundiai Supply Depot
cd3d09fbe6e3e9ff0c0ac0c300e93ae7,nova odessa,SP,PrimeAxis Nova Odessa Distribution Center
57e632711dec9ec14ca7546769483e7e,navegantes,SC,UrbanLift Navegantes Logistics Hub
cb3dd9ce66268c7a3ca7241ac70ab58c,sao paulo,SP,NovaPort Sao Paulo Freight Terminal
094ced053e257ae8cae57205592d6712,ribeirao preto,SP,TerraFleet Ribeirao Preto Logistics Hub
9906e7aa42a3c067b7c9a564d01c4320,maringa,PR,MetroCargo Maringa Freight Terminal
1f1bb1f0859883505541bdd6606193e5,sao paulo,SP,NovaPort Sao Paulo Supply Depot
4200ddf1967c5e41e48db62bc6d4b5ac,sao bernardo do campo,SP,MetroCargo Sao Bernardo Do Campo Distribution Center
ed9eef5be0992d413d251fadba1a410d,mogi guacu,SP,UrbanLift Mogi Guacu Logistics Hub
139157dd4daa45c25b0807ffff348363,sao paulo,SP,SkyRoute Sao Paulo Supply Depot
c1849d4d32d7a6cecd5aa471809d3135,santo andre,SP,UrbanLift Santo Andre Logistics Hub
64b87978a11c1ea7501a89eabe8c2c1a,presidente bernardes,SP,UrbanLift Presidente Bernardes Distribution Center
33ab10be054370c254ddfcf0a6253422,rio de janeiro,RJ,CargoPulse Rio De Janeiro Logistics Hub
bff9deb0ec77d437f3305a79cf25529e,limeira,SP,UrbanLift Limeira Supply Depot
3fefda3299e6dfaea3466ef346a3571a,curitiba,PR,NovaPort Curitiba Supply Depot
236585a4ddb5fea9fa40233e2249ed91,caxias do sul,RS,PrimeAxis Caxias Do Sul Freight Terminal
499ec63c58e51296c9cf57edcfe1c8a8,sao paulo,SP,MetroCargo Sao Paulo Transit Hub
6f83d9e4da896daae20b9b6b2d3ff8d2,pinhalao,PR,MetroCargo Pinhalao Logistics Hub
35ef5aa32949680f627efec3c23e705c,sombrio,SC,CargoPulse Sombrio Logistics Hub
403aa86912527d730337ffcb0fb096ab,belo horizonte,MG,SkyRoute Belo Horizonte Logistics Hub
ec8463980a4e0ea9f8517aea1ed0c419,florianopolis,SC,RouteSphere Florianopolis Logistics Hub
c847e075301870dd144a116762eaff9a,uberaba,MG,SkyRoute Uberaba Transit Hub
6c77cd583b36a13aacccf2b3ee23e233,marilia,SP,TerraFleet Marilia Supply Depot
5ef131ac72773e5b3f6c0d63cf424657,ribeirao preto,SP,BlueLane Ribeirao Preto Supply Depot
6cf476a4ca74498db55cbccdaa9dcfb6,sao paulo,SP,BlueLane Sao Paulo Freight Terminal
c447f8dd3ed213f291d65ef074a268eb,assis,SP,BlueLane Assis Logistics Hub
4736e9d642ef4257cd7622516931eb51,piracicaba,SP,PrimeAxis Piracicaba Freight Terminal
a5cba26a62b8b4d0145b68b841e62e7f,campo mourao,PR,AeroLink Campo Mourao Freight Terminal
a1bea9970d8f65b240555f99c2214f7f,pinhais,PR,TerraFleet Pinhais Supply Depot
1025f0e2d44d7041d6cf58b6550e0bfa,sao paulo,SP,BlueLane Sao Paulo Distribution Center
a5dd1946fb63ada8bcaa0c9cd8f11e22,caruaru,PE,RouteSphere Caruaru Freight Terminal
c5f7feb04a6a1fb3596322bfc3cf1917,sao caetano do sul,SP,UrbanLift Sao Caetano Do Sul Distribution Center
c3e1abd72a42fe690fcd89cf5720fe29,mogi guacu,SP,AeroLink Mogi Guacu Transit Hub
891071be6ba827b591264c90c2ae8a63,sao paulo,SP,MetroCargo Sao Paulo Supply Depot
491a5ada3aa1678414e990262c4bbdc1,sao paulo,SP,CargoPulse Sao Paulo Logistics Hub
84deb808079d1be601c209c1e771b1cc,curitiba,PR,TerraFleet Curitiba Logistics Hub
dd58ee93286b0821565574c570e9e1dc,curitiba,PR,SkyRoute Curitiba Freight Terminal
9558aa23f77a9e0a0eca83540999f43b,apucarana,PR,NovaPort Apucarana Supply Depot
3c4e0452bff7a2a788179488d3d77032,colombo,PR,BlueLane Colombo Freight Terminal
ca5832c6960267b71041f74bb39e8b12,xanxere,SC,RouteSphere Xanxere Distribution Center
668bf321538e5072858eaef6087ce027,pinhais,PR,CargoPulse Pinhais Freight Terminal
01266d4c46afa519678d16a8b683d325,curitiba,PR,NovaPort Curitiba Transit Hub
6c99c983ce3b6ba0ab813e6790e81691,uberlandia,MG,TerraFleet Uberlandia Logistics Hub
6aa3928696eab49a19a466e665a649fd,nova iguacu,RJ,AeroLink Nova Iguacu Supply Depot
7d81e74a4755b552267cd5e081563028,sao paulo,SP,NovaPort Sao Paulo Transit Hub
f8d5c7085db9a4ad2b8c1ffbeb2798c8,sao paulo,SP,TerraFleet Sao Paulo Transit Hub
7586919161935337bf6b6d7ff5779648,rio de janeiro,RJ,NovaPort Rio De Janeiro Transit Hub
47f55702f598c7c6cc8458b0fbc1c49a,dores de campos,MG,MetroCargo Dores De Campos Freight Terminal
50a7e551a7b3f8d37cd6e32d8bfbe5ea,sao caetano do sul,SP,CargoPulse Sao Caetano Do Sul Distribution Center
ea1776927851da2532aa70d6a32c095a,sao paulo,SP,CargoPulse Sao Paulo Supply Depot
827f8f69dfa529c561901c4f2e0f332f,curitiba,PR,PrimeAxis Curitiba Distribution Center
60ad151920c4f6f3ebbe8cfdf6166779,carapicuiba,SP,SkyRoute Carapicuiba Transit Hub
59fb871bf6f4522a87ba567b42dafecf,sao paulo,SP,TerraFleet Sao Paulo Transit Hub
fa74b2f3287d296e9fbd2cc80f2d1cf1,presidente prudente,SP,SkyRoute Presidente Prudente Supply Depot
52454f90d4c30c016768db02f88c1a74,campinas,SP,MetroCargo Campinas Supply Depot
a1043bafd471dff536d0c462352beb48,ilicinea,MG,SkyRoute Ilicinea Distribution Center
3338e7a0710a195872be80e0d2423867,piracicaba,SP,BlueLane Piracicaba Transit Hub
8378eb36b6b70c5734e83ad7b8cdc3b7,itajai,SC,MetroCargo Itajai Freight Terminal
f7df46c1e0ec44eed5c6726478da4a17,novo hamburgo,RS,UrbanLift Novo Hamburgo Freight Terminal
3fac58ce0ad699020c7944d53c41329c,sao paulo,SP,UrbanLift Sao Paulo Transit Hub
debe6615cd90cc0c2eac2b8988e1f628,sao paulo,SP,AeroLink Sao Paulo Supply Depot
baa49d93c8c8841e27400a300f5d74b2,sao jose,SC,RouteSphere Sao Jose Transit Hub
5ca5d579b5857ee8709479b1047cecc3,sao paulo,SP,MetroCargo Sao Paulo Logistics Hub
3b872fd4747f01cc56206f2934198618,ibitinga,SP,PrimeAxis Ibitinga Distribution Center
