warehouse_id,city,state,warehouse_name
3442f8959a84dea7ee197c632cb2df15,campinas,SP,RouteSphere Campinas Distribution Center
d1b65fc7debc3361ea86b5f14c68d2e2,mogi guacu,SP,SkyRoute Mogi Guacu Supply Depot
ce3ad9de960102d0677a81f5d0bb7b2d,rio de janeiro,RJ,AeroLink Rio De Janeiro Freight Terminal
c0f3eea2e14555b6faeea3dd58c1b1c3,sao paulo,SP,NovaPort Sao Paulo Supply Depot
51a04a8a6bdcb23deccc82b0b80742cf,braganca paulista,SP,RouteSphere Braganca Paulista Logistics Hub
c240c4061717ac1806ae6ee72be3533b,rio de janeiro,RJ,RouteSphere Rio De Janeiro Transit Hub
e49c26c3edfa46d227d5121a6b6e4d37,brejao,PE,AeroLink Brejao Distribution Center
1b938a7ec6ac5061a66a3766e0e75f90,penapolis,SP,MetroCargo Penapolis Freight Terminal
768a86e36ad6aae3d03ee3c6433d61df,sao paulo,SP,MetroCargo Sao Paulo Logistics Hub
ccc4bbb5f32a6ab2b7066a4130f114e3,curitiba,PR,MetroCargo Curitiba Supply Depot
8cb7c5ddf41f4d506eba76e9a4702a25,anapolis,GO,TerraFleet Anapolis Freight Terminal
a7a9b880c49781da66651ccf4ba9ac38,itirapina,SP,TerraFleet Itirapina Logistics Hub
8bd0f31cf0a614c658f6763bd02dea69,sao paulo,SP,BlueLane Sao Paulo Logistics Hub
05a48cc8859962767935ab9087417fbb,sao paulo,SP,MetroCargo Sao Paulo Logistics Hub
7b8e8ec35bad4b0ef7e3963650b0a87b,tubarao,SC,MetroCargo Tubarao Transit Hub
1444c08e64d55fb3c25f0f09c07ffcf2,lauro de freitas,BA,NovaPort Lauro De Freitas Logistics Hub
166e8f1381e09651983c38b1f6f91c11,imbituba,SC,SkyRoute Imbituba Supply Depot
e38db885400cd35c71dfd162f2c1dbcf,brasilia,DF,BlueLane Brasilia Supply Depot
d2e753bb80b7d4faa77483ed00edc8ca,porto seguro,BA,RouteSphere Porto Seguro Distribution Center
f9ec7093df3a7b346b7bcf7864069ca3,sao paulo,SP,AeroLink Sao Paulo Supply Depot
4e6015589b781adaa5ce7f1892d06bb1,guaruja,SP,SkyRoute Guaruja Freight Terminal
4cf490a58259286ada5ba8525ba9e84a,tabatinga,SP,SkyRoute Tabatinga Supply Depot
f7496d659ca9fdaf323c0aae84176632,sao paulo,SP,BlueLane Sao Paulo Supply Depot
2ff97219cb8622eaf3cd89b7d9c09824,salto,SP,CargoPulse Salto Transit Hub
8bd0e3abda539b9479c4b44a691be1ec,tres de maio,RS,CargoPulse Tres De Maio Logistics Hub
2a1348e9addc1af5aaa619b1a3679d6b,belo horizonte,MG,RouteSphere Belo Horizonte Transit Hub
2078fe5066350e7d220c0ad3a3bbc6c1,arapongas,PR,TerraFleet Arapongas Transit Hub
116ccb1a1604bc88e4d234a8c23f33de,sao bernardo do campo,SP,RouteSphere Sao Bernardo Do Campo Freight Terminal
430315b7bb4b6e4b3c978f9dfa9b0558,sao paulo,SP,RouteSphere Sao Paulo Transit Hub
406822777a0b9eb5c50e442dd4cd3ec5,tatui,SP,BlueLane Tatui Freight Terminal
4dbd95a08b31ede5c82d3f861cb1ce1a,curitiba,PR,TerraFleet Curitiba Logistics Hub
e9e446d01bd10a97a8ffcfc4a3a20cb2,sao paulo,SP,RouteSphere Sao Paulo Logistics Hub
d52cbce9845184537284a23c3bc3da0e,garopaba,SC,SkyRoute Garopaba Freight Terminal
d9a84e1403de8da0c3aa531d6d108ba6,sao paulo,SP,UrbanLift Sao Paulo Freight Terminal
9c690ceacd5c66731bf443ea810195cb,camanducaia,MG,CargoPulse Camanducaia Distribution Center
1f9ab4708f3056ede07124aad39a2554,tupa,SP,BlueLane Tupa Transit Hub
1961c3e1272bfeceb05d0b78b5bbfdaf,guarulhos,SP,PrimeAxis Guarulhos Logistics Hub
d3e7d37c0df9aef383f3f2a15b0dddfb,sao jose dos pinhais,PR,AeroLink Sao Jose Dos Pinhais Supply Depot
ec2e006556300a79a5a91e4876ab3a56,sao paulo,SP,NovaPort Sao Paulo Freight Terminal
b2a6d334e2833acea353624840e25a0e,sao paulo,SP,CargoPulse Sao Paulo Supply Depot
d3674f271c91f824f82d24d92011f669,brasilia,DF,RouteSphere Brasilia Supply Depot
768de2a4fc06aacecb9a586ccc30746a,brasilia,DF,AeroLink Brasilia Supply Depot
a81466620e46a6970b22ef40379fdfc9,sao ludgero,SC,BlueLane Sao Ludgero Distribution Center
5c030029b5916fed0986310385ec9009,sao jose,SC,SkyRoute Sao Jose Freight Terminal
c0f783394e37cd9c9d7f5f81141450fa,piracicaba,SP,TerraFleet Piracicaba Transit Hub
c353f8fc0ce8344999f17d578eb69a5e,porto alegre,RS,SkyRoute Porto Alegre Freight Terminal
8444e55c1f13cd5c179851e5ca5ebd00,congonhal,MG,TerraFleet Congonhal Logistics Hub
28a26ebce31d5918b181ede016fd693b,belo horizonte,MG,RouteSphere Belo Horizonte Logistics Hub
41ab63a91b8b264e8c8780368bf1dd5b,belo horizonte,MG,NovaPort Belo Horizonte Transit Hub
8759e7aedd644f487315e5860962f162,santo andre,SP,UrbanLift Santo Andre Logistics Hub
e546117ed9cafbc40239c0c78635c584,sao paulo,SP,NovaPort Sao Paulo Logistics Hub
d71d863e5ef30d94e440c11be17dcd8f,osasco,SP,UrbanLift Osasco Logistics Hub
0c7533c71df861ec58ad7ff999ed0e8d,valinhos,SP,TerraFleet Valinhos Transit Hub
ef990a83bbea832f36ebe81376335aa8,joinville,SC,MetroCargo Joinville Freight Terminal
41e0fa5761c886a630994a55c12087e7,guaruja,SP,PrimeAxis Guaruja Transit Hub
0747d5bb69f0586cc869d8af4c50f93e,saquarema,RJ,CargoPulse Saquarema Transit Hub
7d294cf9a6a69dc6a0c3e540fff0e039,barra velha,SC,TerraFleet Barra Velha Freight Terminal
c89cf7c468a48af70aada384e722f9e2,petropolis,RJ,SkyRoute Petropolis Distribution Center
b7ba853e9551f4558440881fd3e5c815,santo antonio da patrulha,RS,PrimeAxis Santo Antonio Da Patrulha Supply Depot
13c2ed7698b3ca92dad49e849219da59,ponta grossa,PR,AeroLink Ponta Grossa Distribution Center
cbbd5ae8f53de5f5097cd8217b529e24,santana de parnaiba,SP,PrimeAxis Santana De Parnaiba Freight Terminal
02ecc2a19303f05e59ce133fd923fff7,santo andre,SP,NovaPort Santo Andre Logistics Hub
c013e57c075a06e5b5c48ee03c525719,sao carlos,SP,BlueLane Sao Carlos Distribution Center
55f7a3319d80f7fdf078b8f03e6725fe,osasco,SP,RouteSphere Osasco Logistics Hub
2d50d6282f8aa2257819a77bfaa0efe0,ibitinga,SP,CargoPulse Ibitinga Supply Depot
b7e1750c1157341d2abd0251e07c186b,sao paulo,SP,PrimeAxis Sao Paulo Distribution Center
b90e891671cffd9557f33a97dc523645,sao jose dos pinhais,PR,PrimeAxis Sao Jose Dos Pinhais Supply Depot
a416b6a846a11724393025641d4edd5e,sao paulo,SP,CargoPulse Sao Paulo Transit Hub
7e93a43ef30c4f03f38b393420bc753a,barueri,SP,UrbanLift Barueri Supply Depot
5206cc4bc2297c833e6061c49bf9c43f,osasco,SP,RouteSphere Osasco Distribution Center
f410c8873029fcc3809b9df6d0b28914,caxias do sul,SP,RouteSphere Caxias Do Sul Supply Depot
ef506c96320abeedfb894c34db06f478,sao paulo,SP,CargoPulse Sao Paulo Transit Hub
a13aaf2d2886ab9fb30fb9a920160b8f,joinville,SC,PrimeAxis Joinville Distribution Center
7299e27ed73d2ad986de7f7c77d919fa,araguari,MG,PrimeAxis Araguari Freight Terminal
8a9260f2b0340411d6d2a56bcf4f7378,contagem,MG,NovaPort Contagem Distribution Center
dedcab67899479e4ea5dcc4eba47f587,jaragua do sul,SC,TerraFleet Jaragua Do Sul Transit Hub
b2479f944e1b90cf8a5de1bbfde284d6,ibitinga,SP,RouteSphere Ibitinga Supply Depot
7722b1df1b0e383e000397b2c11e3e19,sao bernardo do campo,SP,NovaPort Sao Bernardo Do Campo Transit Hub
731ef20c231d9a7103a425e83fd91271,lages - sc,SC,NovaPort Lages - Sc Freight Terminal
78813699ffac347fe27dba345a5f1551,bento goncalves,RS,NovaPort Bento Goncalves Freight Terminal
3296662b1331dea51e744505065ae889,catanduva,SP,MetroCargo Catanduva Transit Hub
411f3b52d857390502ee4e4d5ceabc2d,ribeirao pires,SP,MetroCargo Ribeirao Pires Distribution Center
bba3293d6f5d5af2f415e004e8b93ae3,sao paulo,SP,RouteSphere Sao Paulo Supply Depot
4e7c18b98d84e05cbae3ff0ff03846c2,jaboticabal,SP,UrbanLift Jaboticabal Logistics Hub
b56906f7fd1696e043f1bcce164c487b,echapora,SP,UrbanLift Echapora Supply Depot
d650b663c3b5f6fb392b6326366efa9a,cotia,SP,MetroCargo Cotia Transit Hub
669ae81880e08f269a64487cfb287169,rio do sul,SC,MetroCargo Rio Do Sul Transit Hub
c2d70ce2c5d0a2eb75e78668236e6dc8,sao paulo,SP,CargoPulse Sao Paulo Transit Hub
674207551483fec113276b67b0d871ff,sorocaba,SP,SkyRoute Sorocaba Logistics Hub
abe42c5d03695b4257b5c6cbf4e6784e,rio de janeiro,RJ,PrimeAxis Rio De Janeiro Logistics Hub
1996942dc085d7773ba77a529b163cd0,pradopolis,SP,CargoPulse Pradopolis Transit Hub
79b93a308a97792cf53ac75f46da00b5,rio de janeiro,RJ,MetroCargo Rio De Janeiro Logistics Hub
7cf4ea70955b00d6b3c22542598e2715,sao paulo,SP,SkyRoute Sao Paulo Distribution Center
63ffcb71394dd8ea3872ed9ffda17c74,itaborai,RJ,UrbanLift Itaborai Distribution Center
83353a83fd769dfafa4f21a72b15e3e5,sao paulo,SP,PrimeAxis Sao Paulo Logistics Hub
cda598c48d7c614bc1cad7d8ff6f0010,mirassol,SP,RouteSphere Mirassol Freight Terminal
d4910f1cdcfdabd48d6b316e395d4a23,santo andre,SP,RouteSphere Santo Andre Logistics Hub
709e16e2b25c7474d980076c6bfc4806,birigui,SP,MetroCargo Birigui Freight Terminal
9dc79dd988ac42f4d56c340d7048420a,sao paulo,SP,UrbanLift Sao Paulo Distribution Center
276677b5d08786d5dce7c2149dcce48b,belo horizonte,MG,CargoPulse Belo Horizonte Supply Depot
9c4d31c7e46ab03a43fc06e3142afd4e,rio de janeiro,RJ,PrimeAxis Rio De Janeiro Transit Hub
512d298ac2a96d1931b6bd30aa21f61d,rio de janeiro,RJ,UrbanLift Rio De Janeiro Logistics Hub
422be4cc81a457fdb46f47edeb968ae5,ibitinga,SP,RouteSphere Ibitinga Freight Terminal
99cd94252748d2bdde08e17858233602,sao paulo,SP,UrbanLift Sao Paulo Distribution Center
698624c6632eeba1774924dbea24c700,sao paulo,SP,MetroCargo Sao Paulo Logistics Hub
8bb48dc19fccaa8613b6229bf7f452a2,assis,SP,TerraFleet Assis Freight Terminal
ad87df7699e83b8a91822a4a0b765c3a,jaguariuna,SP,SkyRoute Jaguariuna Freight Terminal
d6b664fa0667064c6d76394e7848d790,araraquara,SP,AeroLink Araraquara Transit Hub
98f52e1020fe788c10c0418de4393fec,macae,RJ,CargoPulse Macae Transit Hub
62760d278921b5f352461620d68a9cee,salto,SP,TerraFleet Salto Distribution Center
eb72802c83dc7547529c9546d1a9b8ef,rio claro,SP,RouteSphere Rio Claro Freight Terminal
3f9be91358837bff69df67edfa3e42e8,londrina,PR,PrimeAxis Londrina Distribution Center
1d4587203296c8f4ad134dc286fa6db0,sao paulo,SP,BlueLane Sao Paulo Distribution Center
791cfcfe22fe4a771ece27f90017da92,ribeirao preto,SP,TerraFleet Ribeirao Preto Supply Depot
392f7f2c797e4dc077e4311bde2ab8ce,rio de janeiro,RN,SkyRoute Rio De Janeiro Supply Depot
0c8380b62e38e8a1e6adbeba7eb9688c,tres coracoes,MG,AeroLink Tres Coracoes Distribution Center
37be5a7c751166fbc5f8ccba4119e043,sao paulo,SP,RouteSphere Sao Paulo Transit Hub
87d73636a3acf123e842bb890a4db036,nhandeara,SP,SkyRoute Nhandeara Logistics Hub
3d3ccf2b2f8134b10dce9dd446f0e075,ibitinga,SP,CargoPulse Ibitinga Transit Hub
e24d3429d294b2eb200b064ebb035879,sao paulo,SP,RouteSphere Sao Paulo Distribution Center
44073f8b7e41514de3b7815dd0237f4f,brasilia,DF,NovaPort Brasilia Distribution Center
05ca864204d09595ae591b93ea9cf93d,barueri,SP,MetroCargo Barueri Freight Terminal
9d39404483343dd55c7ae254494d8388,sao paulo,SP,TerraFleet Sao Paulo Supply Depot
f9eda05b67bef472deaddbba84aca289,orleans,SC,SkyRoute Orleans Logistics Hub
75745ef7bc7d4f3ea3380f6f5303f514,brasilia,DF,TerraFleet Brasilia Supply Depot
0692610d8abe24f287e9fae90ea0bbee,sao paulo,SP,RouteSphere Sao Paulo Transit Hub
7b07b3c7487f0ea825fc6df75abd658b,sao paulo,SP,PrimeAxis Sao Paulo Freight Terminal
99002261c568a84cce14d43fcffb43ea,cuiaba,MT,NovaPort Cuiaba Logistics Hub
e5899683388855d3dabe8913bbe365de,sao carlos,SP,NovaPort Sao Carlos Logistics Hub
784ba75dd9d20200c4caed3d7a77141a,sao paulo,SP,AeroLink Sao Paulo Supply Depot
099095b050cfe8eb1ddff5317587e96e,sao paulo,SP,UrbanLift Sao Paulo Supply Depot
0ad80de75c811326389cfb1daba7d45e,rio de janeiro,RJ,AeroLink Rio De Janeiro Supply Depot
b9a03475e6447e631b6799ec8274800f,formosa do oeste,PR,PrimeAxis Formosa Do Oeste Freight Terminal
ba6b4a237f92479743cf0ca06b67a9ac,rio de janeiro,RJ,MetroCargo Rio De Janeiro Logistics Hub
ea00f977a203ff88adf7057cb7806998,santos,SP,UrbanLift Santos Logistics Hub
82e0a475a88cc9595229d8029273f045,sao paulo,SP,CargoPulse Sao Paulo Supply Depot
ad75519a07f039025e83795a4418470f,santa terezinha de goias,GO,BlueLane Santa Terezinha De Goias Transit Hub
34aefe746cd81b7f3b23253ea28bef39,curitiba,PR,RouteSphere Curitiba Transit Hub
ed4acab38528488b65a9a9c603ff024a,sao paulo,SP,NovaPort Sao Paulo Transit Hub
f0837c8d71434931d9e38e7b79234797,arvorezinha,RS,NovaPort Arvorezinha Transit Hub
fce62094ffe6a4009188ec44e681dfdd,sao paulo,SP,SkyRoute Sao Paulo Supply Depot
ebef8d8c92b4fd3226e5d407bbff21ac,ribeirao preto,SP,AeroLink Ribeirao Preto Freight Terminal
d73cbd89533ce8b041a9190241453ac8,guiricema,MG,RouteSphere Guiricema Transit Hub
75a4764c108403a7a0575140cb22287c,caxias do sul,RS,MetroCargo Caxias Do Sul Freight Terminal
70c0fda4c313d87115644d39e62eec60,caruaru,PE,RouteSphere Caruaru Logistics Hub
ffcfefa19b08742c5d315f2791395ee5,curitiba,PR,CargoPulse Curitiba Freight Terminal
26e13b6ff5b641b329e5524241ee2c93,franca,SP,NovaPort Franca Supply Depot
0ade5cc4a305ed7093a23f68ca47519c,curitiba,PR,CargoPulse Curitiba Logistics Hub
fc59392d66ef99377e50356ee4f3b4e1,salvador,BA,MetroCargo Salvador Logistics Hub
b18dc380845b24038cfc48006478f099,diadema,SP,TerraFleet Diadema Freight Terminal
f22a247b79dd22ecd91dc8e3b2a1b07c,itaquaquecetuba,SP,NovaPort Itaquaquecetuba Freight Terminal
889009a0ed0bb52c87819941192931b8,lencois paulista,SP,TerraFleet Lencois Paulista Transit Hub
ffc470761de7d0232558ba5e786e57b7,guarulhos,SP,SkyRoute Guarulhos Transit Hub
4c498c7345e89aebad651544829beca0,carapicuiba,SP,PrimeAxis Carapicuiba Supply Depot
01bcc9d254a0143f0ce9791b960b2a47,uruacu,GO,MetroCargo Uruacu Supply Depot
f021c962aaba8ef6eb527a9c2c8394d1,itajai,SC,BlueLane Itajai Distribution Center
024b564ae893ce8e9bfa02c10a401ece,sao paulo,SP,BlueLane Sao Paulo Supply Depot
a513150f33f99a06569e9cd5c4bb889b,sao paulo,SP,MetroCargo Sao Paulo Freight Terminal
c1dde11f12d05c478f5de2d7319ad3b2,sao paulo,SP,CargoPulse Sao Paulo Distribution Center
02f5837340d7eb4f653d676c7256523a,curitiba,PR,AeroLink Curitiba Distribution Center
7b98de631987e26dd6d803490c43a13c,loanda,PR,MetroCargo Loanda Logistics Hub
f12ff17ad8bbf01ec5c33b17e506649b,sao paulo,SP,UrbanLift Sao Paulo Transit Hub
a64e44665225d19dfc0277eeeaaccc57,sao paulo,SP,PrimeAxis Sao Paulo Logistics Hub
6a8a889bde935bafa76d7848782dfaf9,sao paulo,SP,RouteSphere Sao Paulo Transit Hub
42b6488f5b8246d9141712abd4b1b693,maringa,PR,AeroLink Maringa Transit Hub
d6cd01c59123df02fc226eadbadb5f89,sao paulo,SP,TerraFleet Sao Paulo Supply Depot
c8e135e7b21ecbc36c1153a29d2f5a06,sao paulo,SP,TerraFleet Sao Paulo Supply Depot
229c3efbfb0ea2058de4ccdfbc3d784a,belo horizonte,MG,RouteSphere Belo Horizonte Distribution Center
f9a02f1922d1de564392e656d82b3fda,ferraz de vasconcelos,SP,MetroCargo Ferraz De Vasconcelos Freight Terminal
9523fb39dd240aa958e040f8183d64f3,sao paulo,SP,NovaPort Sao Paulo Transit Hub
95ec4458365c4d11f452ccf538377619,limeira,SP,PrimeAxis Limeira Supply Depot
6ec1a01e866584bb679eb9b098345919,santos,SP,SkyRoute Santos Transit Hub
f6122bc84774df1b372bdb3bb88ddb9f,barueri,SP,CargoPulse Barueri Supply Depot
fa40cc5b934574b62717c68f3d678b6d,sao paulo,SP,TerraFleet Sao Paulo Freight Terminal
623ad9d0c1e14bb5464a8c72bff7b4af,claudio,MG,BlueLane Claudio Supply Depot
c0098efcf800861dcae589affca31408,ribeirao preto,SP,AeroLink Ribeirao Preto Freight Terminal
a63bfbaa882c8f4542891b4e2246cc7f,niteroi,RJ,RouteSphere Niteroi Supply Depot
48b6c3f4c6a93171da04b75313f2130f,osvaldo cruz,SP,NovaPort Osvaldo Cruz Logistics Hub
270d3ef21830ad0ecf3a6c53d08a533a,carapicuiba,SP,PrimeAxis Carapicuiba Freight Terminal
89c127985a8b130cfa45c1d36764017a,osasco,SP,MetroCargo Osasco Supply Depot
8b2492b7ff4468839593fafeed55bad9,sao goncalo,RJ,BlueLane Sao Goncalo Transit Hub
1e9d5a33694bddb76316fd1f54734d20,jaciara,MT,BlueLane Jaciara Logistics Hub
5e49e3a44bdeb5aab2684258bbd4f525,balenario camboriu,SC,NovaPort Balenario Camboriu Logistics Hub
8e34331b7eedd03be4e5d965c1956225,sao paulo,SP,BlueLane Sao Paulo Supply Depot
aaed1309374718fdd995ee4c58c9dfcd,timbo,SC,CargoPulse Timbo Logistics Hub
11d4c477d09821164bca4f70a2eae031,ribeirao preto,SP,CargoPulse Ribeirao Preto Supply Depot
ff314fa6033cc68ec451c47aee2d6ba4,sao paulo,SP,TerraFleet Sao Paulo Logistics Hub
d1c7fa84e48cfa21a0e595167c1c500e,jacutinga,RS,SkyRoute Jacutinga Supply Depot
c7246702dc991a06d788120dc7544391,fortaleza,CE,SkyRoute Fortaleza Freight Terminal
e819bcfade7b5d88a27325eb6cfd62c5,guarulhos,SP,SkyRoute Guarulhos Freight Terminal
6d2f2e3b539480db1e0842b3a4e32e6e,guarulhos,SP,SkyRoute Guarulhos Transit Hub
e88165a185134e13fdfc85d4fa654db8,ferraz de  vasconcelos,SP,UrbanLift Ferraz De  Vasconcelos Distribution Center
9e6229250fedbe05838fef417b74e7fb,mirandopolis,SP,TerraFleet Mirandopolis Supply Depot
5abb8ea023c77787f2c15da891c8d384,joinville,SC,TerraFleet Joinville Logistics Hub
1d953075c2f0dd990bacf27b83b330f1,belo horizonte,MG,PrimeAxis Belo Horizonte Supply Depot
817245bcc3badd82bbd222e0366951a6,bauru,SP,NovaPort Bauru Logistics Hub
caa9bc43a9fe8cf9c564ddd8a03cc4a6,jacarei,SP,NovaPort Jacarei Freight Terminal
615005a3ef192c00c6f0e977cee3d2bc,itu,SP,MetroCargo Itu Logistics Hub
1284de4ae8aa26997e748c851557cf0e,laranjeiras do sul,SP,NovaPort Laranjeiras Do Sul Freight Terminal
5fd924b4836098a5be0ecf81ba054ce0,sao paulo,SP,BlueLane Sao Paulo Supply Depot
7178f9f4dd81dcef02f62acdf8151e01,videira,SC,BlueLane Videira Freight Terminal
8132b9bd16876e1b0f8808d43825dd48,florianopolis,SC,RouteSphere Florianopolis Logistics Hub
3f995f07c49d0d55a99d5c54957f7d81,itapecerica da serra,SP,CargoPulse Itapecerica Da Serra Transit Hub
a6bd7d1ccdac48c6b33b28596b7eb122,mamanguape,PB,AeroLink Mamanguape Supply Depot
6650fcccd8cd2f7e55ffa524f30c4c59,sao paulo,SP,TerraFleet Sao Paulo Freight Terminal
3db66a856d18a9cba7c9241fc5221c50,ponte nova,MG,BlueLane Ponte Nova Distribution Center
8b181ee5518df84f18f4e1a43fe07923,goioere,SP,CargoPulse Goioere Supply Depot
10ff823eda2b032e2c93d17a7d294736,pederneiras,SP,RouteSphere Pederneiras Supply Depot
b4a476fbd28de64b1e347abf9089366a,itapevi,SP,SkyRoute Itapevi Distribution Center
39c763cca83e654764b7a4a650fb9b7c,goiania,GO,SkyRoute Goiania Distribution Center
dadc51ef321949ec9a3ab25cd902e23d,sao paulo,SP,BlueLane Sao Paulo Logistics Hub
83b08de96980757220871b31bf6cffca,rio de janeiro,RJ,TerraFleet Rio De Janeiro Logistics Hub
14a08204d03bb6b6bde8029f801ae0eb,sao paulo,SP,CargoPulse Sao Paulo Logistics Hub
bee36b4f9a2b9fdcaff6ec05df202ed0,sao paulo,SP,UrbanLift Sao Paulo Supply Depot
28872dc528e978a639754bc8c2ce5a4c,caxias do sul,RS,UrbanLift Caxias Do Sul Distribution Center
c85d7b477a709c85a1e8b8f25aa1b270,sao bernardo do campo,SP,BlueLane Sao Bernardo Do Campo Distribution Center
739c7d7be81f63812dea0d1b1451c651,campina grande,PB,PrimeAxis Campina Grande Freight Terminal
657969cca82e884d272385ec0ef06edd,estancia velha,RS,AeroLink Estancia Velha Transit Hub
455befea1bb853c75ccbca94cff26e5c,resende,RJ,PrimeAxis Resende Transit Hub
800214c63934acd05d47e84214db8ba8,jaragua do sul,SC,NovaPort Jaragua Do Sul Supply Depot
5cf1ec37aea089f45110c70653a166ab,sao paulo,SP,MetroCargo Sao Paulo Transit Hub
0a82f5fb06a4fe4ac2cf7cb412ec71b8,sao paulo,SP,UrbanLift Sao Paulo Distribution Center
e45edf75f568ed2f93f78d060e246e25,rio de janeiro,RJ,NovaPort Rio De Janeiro Supply Depot
3d621842b2ed28e2b474132480edac3c,sao paulo,SP,NovaPort Sao Paulo Distribution Center
baf15155e37ef5492731459bdc05be8a,sao paulo,SP,PrimeAxis Sao Paulo Logistics Hub
c0aff2da32c17759d30b22fb0af6649d,florianopolis,SC,BlueLane Florianopolis Supply Depot
a17f621c590ea0fab3d5d883e1630ec6,sorocaba,SP,RouteSphere Sorocaba Transit Hub
4deebb3199eeafb282ae33229144f94b,sao paulo,SP,SkyRoute Sao Paulo Logistics Hub
9d69ba0a7a626a64dc5db08e529559cf,ribeirao preto,SP,SkyRoute Ribeirao Preto Distribution Center
f92d8c817434bd2d84d4e9c61322b7fa,sorocaba,SP,SkyRoute Sorocaba Distribution Center
8ca5b19e0263150d2c57afdde2b3d011,maua,SP,UrbanLift Maua Freight Terminal
eec3469d83e142f9a104886655338c37,bauru,SP,MetroCargo Bauru Distribution Center
55bb6fe5bebe5012e2d7d9928e1128ff,bauru,SP,SkyRoute Bauru Logistics Hub
d180e07dc1e58c31c3f0cd599dc4d945,belo horizonte,MG,PrimeAxis Belo Horizonte Freight Terminal
d6b1ce66b035a475f00c017792ff9769,salto,SP,UrbanLift Salto Logistics Hub
3aa3c89ae3cd482385568be76120f63c,goiania,GO,TerraFleet Goiania Logistics Hub
fe4cd9461203cee790d36792420b310f,caratinga,MG,CargoPulse Caratinga Distribution Center
c3aad7dc65449ae90a5e9c3c6c1e78e0,auriflama/sp,SP,UrbanLift Auriflama/Sp Logistics Hub
f5fea3ffed6c2e889bab72705557c63a,rio de janeiro,RJ,AeroLink Rio De Janeiro Freight Terminal
ececbfcff9804a2d6b40f589df8eef2b,franca,SP,TerraFleet Franca Logistics Hub
a254c682cc01e119f83530446f1df9a9,cafelandia,SP,UrbanLift Cafelandia Freight Terminal
830379336fad8c6f3b15a4a3ddb5c66e,sao paulo,SP,TerraFleet Sao Paulo Transit Hub
7d13fca15225358621be4086e1eb0964,ribeirao preto,SP,AeroLink Ribeirao Preto Distribution Center
1b4c3a6f53068f0b6944d2d005c9fc89,sao ludgero,SC,NovaPort Sao Ludgero Transit Hub
b92e3c8f9738272ff7c59e111e108d7c,uba,MG,SkyRoute Uba Logistics Hub
b8555308bfdb4ca1ed54325a58da9a97,sao bernardo do campo,SP,SkyRoute Sao Bernardo Do Campo Freight Terminal
71593c7413973a1e160057b80d4958f6,sao paulo / sao paulo,SP,SkyRoute Sao Paulo / Sao Paulo Freight Terminal
1dc2de47ee26a0a5b12dc14fd6dc0dea,ibitinga,SP,AeroLink Ibitinga Freight Terminal
6c6e3d67f969468f3bfd33f827a31222,maringa,PR,RouteSphere Maringa Freight Terminal
66d5ae34537110d3affc56174dad2b2f,sao jose do rio preto,SP,AeroLink Sao Jose Do Rio Preto Freight Terminal
781a66c0d89e30814d49fe8b5e14cd07,campinas,SP,TerraFleet Campinas Transit Hub
a4bd6e9adf39b63f43dc545d3ca1f53d,rio de janeiro,RJ,UrbanLift Rio De Janeiro Transit Hub
f88adb15807168d3c43d71021090ce4a,porto ferreira,SP,BlueLane Porto Ferreira Logistics Hub
fa8d335d68129e464e60c1826a683e96,tres coroas,RS,PrimeAxis Tres Coroas Logistics Hub
f12d3c2a14729ae461b920c11fe20fdc,santo andre,SP,RouteSphere Santo Andre Transit Hub
4917cee8d902e13428c3ec4b1ca6f315,blumenau,SC,NovaPort Blumenau Distribution Center
741f8c587cb4248ebc5b779a0e8e0e51,santo andre,SP,RouteSphere Santo Andre Supply Depot
4bcec44888b30ba9001234c534716d3f,santo andre,SP,TerraFleet Santo Andre Logistics Hub
a663d9c3797e90eac99ff60939416a56,sao paulo,SP,MetroCargo Sao Paulo Supply Depot
dff87e4de60c9736ce8df835951b09bc,sao paulo,SP,RouteSphere Sao Paulo Distribution Center
ac1ed5fc15901fbc92920361eb4ab350,sao paulo,SP,PrimeAxis Sao Paulo Freight Terminal
f9903dd0f812c7e771fcad47b6fff231,blumenau,SC,SkyRoute Blumenau Supply Depot
ac9b01377919cdbd2a1bbb8d5837c70b,mogi das cruzes,SP,RouteSphere Mogi Das Cruzes Transit Hub
5011f0d93373a4c5753adf58ca77af8d,santos,SP,UrbanLift Santos Transit Hub
a4e634166243bbb3a13fa584463fa468,osasco,SP,SkyRoute Osasco Freight Terminal
50bf89f1349bc0409a268c3a49678009,jaci,SP,CargoPulse Jaci Transit Hub
50c9975695009e5e6473912e83a6d1da,claudio,MG,TerraFleet Claudio Distribution Center
42d4b7e70819438f5ada61c965e92d7e,goiania,GO,NovaPort Goiania Transit Hub
7aa4334be125fcdd2ba64b3180029f14,laranjal paulista,SP,BlueLane Laranjal Paulista Distribution Center
b14db04aa7881970e83ffa9426897925,sorocaba,SP,AeroLink Sorocaba Logistics Hub
fac1a9017ade7bdc94058fc1c969f355,sao paulo,SP,RouteSphere Sao Paulo Supply Depot
31ae0774c17fabd06ff707cc5bde005f,americana,SP,UrbanLift Americana Transit Hub
f0ec6a2adb05c62655a26dd347b8dede,sao paulo,SP,NovaPort Sao Paulo Transit Hub
cc1f04647be106ba74e62b21f358af25,sao paulo,SP,TerraFleet Sao Paulo Distribution Center
1099a00e0ee3a50935e6c2447ca090c5,rio de janeiro,RJ,UrbanLift Rio De Janeiro Supply Depot
3d700782d7818f2c1e0d7a9e9d75fc00,sertanopolis,SP,RouteSphere Sertanopolis Distribution Center
a3e9a2c700480d9bb01fba070ba80a0e,ibitinga,SP,TerraFleet Ibitinga Logistics Hub
c3f5668699a1b04c0fa61ecea1e2bff6,apucarana,PR,TerraFleet Apucarana Distribution Center
80f2cf9abf6b5a0e5c612b5eea6646e6,sao jose do rio preto,SP,CargoPulse Sao Jose Do Rio Preto Distribution Center
516e7738bd8f735ac19a010ee5450d8d,rio de janeiro,RJ,CargoPulse Rio De Janeiro Freight Terminal
4fe2f67634d00c021aa01f96b6f2d68e,maringa,PR,SkyRoute Maringa Freight Terminal
9f505651f4a6abe901a56cdc21508025,sao paulo,SP,UrbanLift Sao Paulo Freight Terminal
17adeba047385fb0c67d8e90b4296d21,guarulhos,SP,MetroCargo Guarulhos Transit Hub
7142540dd4c91e2237acb7e911c4eba2,penapolis,SP,CargoPulse Penapolis Supply Depot
c04d70d515d15a7e3db3a73320598566,niteroi,RJ,PrimeAxis Niteroi Logistics Hub
a3a38f4affed601eb87a97788c949667,joinville,SC,PrimeAxis Joinville Freight Terminal
744dac408745240a2c2528fb1b6028f3,colombo,PR,MetroCargo Colombo Freight Terminal
9b013e03b2ab786505a1d3b5c0756754,vicente de carvalho,SP,PrimeAxis Vicente De Carvalho Transit Hub
8b9d6eec4a7eb7d0f9d579ce0b38324d,mesquita,RJ,PrimeAxis Mesquita Supply Depot
38e679b9e0064cd94c6f035707344dae,londrina,PR,PrimeAxis Londrina Logistics Hub
5444b12c82f21c923f2639ebc722c1ea,sao pauo,SP,CargoPulse Sao Pauo Freight Terminal
83deb69e889cf80f82be1dc6d5f2d486,florianopolis,SC,BlueLane Florianopolis Distribution Center
54aa8463e87776b5612f4bdc4bd5d4de,belo horizonte,MG,SkyRoute Belo Horizonte Distribution Center
2e7ea2aafec5835e781b21d6d1faf1f1,sao paulo,SP,CargoPulse Sao Paulo Distribution Center
79ebd9a61bac3eaf882805ed4ecfa12a,cascavel,PR,RouteSphere Cascavel Freight Terminal
1cbd50a8c52e6cf8e315c5709fab386f,fazenda rio grande,PR,MetroCargo Fazenda Rio Grande Supply Depot
e503f22be6a4f456d9851920a5d9c670,sao paulo,SP,UrbanLift Sao Paulo Supply Depot
88af55b4a7ca402b27df16f7c7c9b5d2,taboao da serra,SP,BlueLane Taboao Da Serra Freight Terminal
5f3ae9136c875522250f8184f253413a,sao paulo,SP,MetroCargo Sao Paulo Freight Terminal
b026643914f651e8371425e5b8a1e780,rio de janeiro,RJ,PrimeAxis Rio De Janeiro Transit Hub
26af45f5dfd967225a832838aa4e24a3,curitiba,PR,BlueLane Curitiba Distribution Center
9dd459b29a14bf89d47183cf2cd0e4c7,sao paulo,SP,CargoPulse Sao Paulo Freight Terminal
8e6d7754bc7e0f22c96d255ebda59eba,sao jose dos campos,SP,CargoPulse Sao Jose Dos Campos Freight Terminal
e250d617a0ad591ba9bd663e584a895d,guarulhos,SP,NovaPort Guarulhos Supply Depot
92c8bc6e8f925792247656fed09aad65,sao paulo,SP,BlueLane Sao Paulo Freight Terminal
e53d5b9b29d1218281f4a907ada18626,toledo,PR,CargoPulse Toledo Freight Terminal
